category,target,img,snd,text
doorknob,0,/home/su-laptop-02-okitani/gmm_ws/data_processed/image/058_0026.npz,/home/su-laptop-02-okitani/gmm_ws/data_processed/audio/2-118624-A-30.npz,ドアノブとは、扉を開閉するために操作する取っ手であり、多くの場合、扉を閉じた状態に保つラッチ機構や、外部からの侵入を防ぐための施錠機構と一体化した部品の総称です。 その形状は、握って回す球状の「丸ノブ」が一般的で、コンパクトさが特徴ですが、近年では指で押し下げて操作する「レバーハンドル」が操作性の高さから広く普及し、また、押したり引いたりして開閉する「プッシュプルハンドル」は両手が塞がっている場合でも肘などで操作できる利便性から、多様なタイプが存在します。
doorknob,0,/home/su-laptop-02-okitani/gmm_ws/data_processed/image/058_0062.npz,/home/su-laptop-02-okitani/gmm_ws/data_processed/audio/5-218981-A-30.npz,耐久性や耐腐食性、防火性なども考慮され、設置場所の環境に応じて適切なものが選定されます。 ドアノブの内部には、スピンドルと呼ばれる角軸が通っており、これを回したり押し下げたりする操作が、ドアの側面にあるラッチボルトに伝わります。 操作によってラッチボルトがドア本体に引き込まれ、ドア枠のストライク（受け座）から外れることで、ドアは開閉可能になります。
doorknob,0,/home/su-laptop-02-okitani/gmm_ws/data_processed/image/058_0036.npz,/home/su-laptop-02-okitani/gmm_ws/data_processed/audio/5-251426-B-30.npz,ドアノブとは、扉を開閉するために操作する取っ手の一種であり、扉に設けられたラッチ（かんぬき）機構と連動して、扉を固定したり解放したりする役割を担う部品です。 一般的には、握って回すことでラッチを引っ込ませ、扉を開けることができる球状のものを指しますが、近年では握りやすいレバー状の「レバーハンドル」も広く普及しており、これらも広義のドアノブに含まれます。 その形状は球形、楕円形、レバー形など多岐にわたり、材質も真鍮、ステンレス、アルミニウムといった金属のほか、木、プラスチック、陶器など様々です。
doorknob,0,/home/su-laptop-02-okitani/gmm_ws/data_processed/image/058_0024.npz,/home/su-laptop-02-okitani/gmm_ws/data_processed/audio/3-182025-A-30.npz,近年では、多くの人が触れる箇所であることから、抗菌・抗ウイルス加工が施された製品や、高齢者や身体の不自由な方でも容易に操作できるよう、軽い力で開閉できるレバーハンドル型がバリアフリーの観点から推奨されるなど、機能性や衛生面への配慮も進化しています。 また、スマートロックと連携し、スマートフォンや生体認証で解錠できる高機能な製品も登場しており、利便性とセキュリティの向上が図られています。
doorknob,0,/home/su-laptop-02-okitani/gmm_ws/data_processed/image/058_0066.npz,/home/su-laptop-02-okitani/gmm_ws/data_processed/audio/3-144510-A-30.npz,これらの素材やデザインは、設置される建築物の様式やインテリアデザインと調和するように選ばれることが一般的で、機能性だけでなく視覚的な要素も重視されます。 ドアノブの基本的な仕組みは、内部に組み込まれたラッチボルトと呼ばれる可動式の部品と連動しています。 ノブを回したりレバーを下げたりすることで、ラッチボルトが扉の枠から引っ込み、扉の固定が解除されて開閉が可能になります。
doorknob,0,/home/su-laptop-02-okitani/gmm_ws/data_processed/image/058_0086.npz,/home/su-laptop-02-okitani/gmm_ws/data_processed/audio/1-81001-B-30.npz,多くのドアノブには施錠機能が一体化しており、鍵穴や、内側から手動で施錠・解錠を行うサムターンが備えられているものも多い。 単なる機能部品としてだけでなく、建築物の内外装デザインの一部としても重要な役割を担い、クラシックなものからモダンなものまで、様々な様式や時代背景を反映した意匠が存在し、空間の雰囲気を決定づける要素となる。
doorknob,0,/home/su-laptop-02-okitani/gmm_ws/data_processed/image/058_0073.npz,/home/su-laptop-02-okitani/gmm_ws/data_processed/audio/3-182025-A-30.npz,ドアノブの主な機能は、これを回したり押し下げたりする操作によって、ドアを固定しているラッチボルトをドア枠から引き込み、ドアが開く状態にすることです。 内部にはスピンドルと呼ばれる角軸が通っており、ノブの操作がこの軸を介してラッチボルトに伝わります。 手を離すと、内蔵されたスプリングの力でラッチボルトが元の位置に戻り、ドアが閉まった際に自動的に固定される仕組みです。
doorknob,0,/home/su-laptop-02-okitani/gmm_ws/data_processed/image/058_0070.npz,/home/su-laptop-02-okitani/gmm_ws/data_processed/audio/3-182025-A-30.npz,ドアノブとは、扉を開閉するために操作する取っ手の一種であり、多くの場合、扉の施錠・解錠機能も兼ね備えている装置である。 その形状は、古くから親しまれている球形（丸型）が一般的だが、近年ではレバーを押し下げることで操作するレバーハンドル型や、引いたり押したりするプッシュプル型など、多様なデザインが存在する。 素材も真鍮、ステンレス、アルミニウムといった金属のほか、木、プラスチック、陶器など多岐にわたり、建築物のデザインや用途に合わせて選択される。
doorknob,0,/home/su-laptop-02-okitani/gmm_ws/data_processed/image/058_0063.npz,/home/su-laptop-02-okitani/gmm_ws/data_processed/audio/5-235644-A-30.npz,耐久性や耐腐食性、防火性なども考慮され、設置場所の環境に応じて適切なものが選定されます。 ドアノブの内部には、スピンドルと呼ばれる角軸が通っており、これを回したり押し下げたりする操作が、ドアの側面にあるラッチボルトに伝わります。 操作によってラッチボルトがドア本体に引き込まれ、ドア枠のストライク（受け座）から外れることで、ドアは開閉可能になります。
doorknob,0,/home/su-laptop-02-okitani/gmm_ws/data_processed/image/058_0047.npz,/home/su-laptop-02-okitani/gmm_ws/data_processed/audio/2-120218-B-30.npz,ドアノブの仕組みは、握り玉を回す、あるいはレバーハンドルを押し下げることで、内部のスピンドルと呼ばれる軸が回転し、これに接続されたラッチボルトが扉の側面から引っ込むことで、扉枠のストライクプレートからラッチが外れ、扉が開くというものである。 多くのドアノブには施錠機能が組み込まれており、鍵穴やサムターン（室内側のつまみ）と一体化している場合や、別途デッドボルトなどの施錠機構と連動している場合がある。 これにより、部屋のプライバシーを確保したり、外部からの侵入を防ぐ防犯対策として機能する。
doorknob,0,/home/su-laptop-02-okitani/gmm_ws/data_processed/image/058_0065.npz,/home/su-laptop-02-okitani/gmm_ws/data_processed/audio/4-261068-A-30.npz,近年では、高齢者や身体の不自由な人でも容易に操作できるよう、軽い力で動かせるレバーハンドルがユニバーサルデザインの観点から広く普及している。 また、多くの人が触れる部位であるため、抗菌・抗ウイルス加工が施された製品や、非接触で開閉できる自動ドアシステムとの連携なども進化しており、衛生面や利便性の向上にも貢献している。
doorknob,0,/home/su-laptop-02-okitani/gmm_ws/data_processed/image/058_0076.npz,/home/su-laptop-02-okitani/gmm_ws/data_processed/audio/3-170574-A-30.npz,ドアノブの基本的な仕組みは、ノブを回すかレバーを押し下げることで、内部に連結されたスピンドルが回転し、扉の側面から突き出ているラッチボルトが扉本体に引き込まれることで、扉が開く状態となる。 手を離すと、内蔵されたバネの力でラッチボルトが元の位置に戻り、扉が閉まる際に扉枠のストライクプレートに収まることで扉が固定される。 施錠機能を持つタイプでは、鍵や内側のサムターン（つまみ）を操作することで、ラッチボルトやデッドボルトを固定し、外部からの開扉を防ぐことができる。
doorknob,0,/home/su-laptop-02-okitani/gmm_ws/data_processed/image/058_0066.npz,/home/su-laptop-02-okitani/gmm_ws/data_processed/audio/1-103999-A-30.npz,多くのドアノブには、鍵穴やサムターン（室内側のつまみ）と連動した施錠機能が組み込まれており、デッドボルトやラッチボルトを固定することで、プライバシーの保護や防犯の役割も果たします。 近年では、ユニバーサルデザインの観点から、高齢者や身体の不自由な方でも操作しやすいレバーハンドル型が広く普及しています。 また、多くの人が日常的に触れることから、感染症対策として抗菌素材の使用や、非接触型の自動ドアへの関心も高まっています。
doorknob,0,/home/su-laptop-02-okitani/gmm_ws/data_processed/image/058_0070.npz,/home/su-laptop-02-okitani/gmm_ws/data_processed/audio/1-26188-A-30.npz,住宅、オフィス、公共施設など、あらゆる建築物の扉に不可欠な部品であり、特にレバーハンドル型は、握力の弱い人や高齢者、障害者でも操作しやすいバリアフリー対応として広く普及している。 また、多くの人が触れることから、衛生面を考慮した抗菌素材の使用や、非接触で開閉できる技術の開発も進められている。 デザイン性も重視され、インテリアの一部として素材や形状、仕上げが選ばれることも多い。
doorknob,0,/home/su-laptop-02-okitani/gmm_ws/data_processed/image/058_0002.npz,/home/su-laptop-02-okitani/gmm_ws/data_processed/audio/1-52290-A-30.npz,住宅、オフィス、公共施設など、あらゆる建築物の扉に不可欠な要素であり、そのデザインはインテリアの一部としても重要な役割を果たします。 関連事項として、ユニバーサルデザインの観点からは、握力の弱い人や高齢者、子供でも容易に操作できるレバーハンドルが推奨される傾向にあります。 また、衛生面を考慮した抗菌加工が施されたものや、非常時に簡単に開けられる機能を持つもの、あるいは特定の環境下での使用を想定した防水・防塵性能を持つものなど、その機能性も時代とともに多様化し、進化を続けています。
doorknob,0,/home/su-laptop-02-okitani/gmm_ws/data_processed/image/058_0036.npz,/home/su-laptop-02-okitani/gmm_ws/data_processed/audio/4-211502-A-30.npz,日常的に触れる機会が多いため、その形状や素材、操作感は、建物の使いやすさや快適性に大きく影響を与える要素となっている。
doorknob,0,/home/su-laptop-02-okitani/gmm_ws/data_processed/image/058_0026.npz,/home/su-laptop-02-okitani/gmm_ws/data_processed/audio/1-81001-B-30.npz,ドアノブとは、ドアの開閉操作を行うために取り付けられる取っ手の一種である。 一般的には球形やレバー形をしており、手で握って回したり押し下げたりすることで、ドアのラッチ（かんぬき）を操作し、ドアを開けることができる。 その素材は真鍮、ステンレス、アルミなどの金属、プラスチック、木材、陶器など多岐にわたり、機能性だけでなく、建物の内装デザインや雰囲気に合わせて装飾性も重視される。
doorknob,0,/home/su-laptop-02-okitani/gmm_ws/data_processed/image/058_0084.npz,/home/su-laptop-02-okitani/gmm_ws/data_processed/audio/1-103999-A-30.npz,ノブを回す、またはレバーを押し下げる動作は、内部のスピンドルと呼ばれる軸を介してラッチボルトを引っ込める機構に伝達される。 これにより、扉は枠から解放され、開くことが可能となる。 扉を閉める際には、ラッチボルトが扉枠に取り付けられたストライクプレートに当たり、自動的に押し戻されて所定の位置に収まることで、扉が固定される仕組みである。 多くのドアノブは、この開閉機能に加えて、鍵穴や内側から操作するサムターンといった錠前（ロック機構）と一体化しており、防犯やプライバシー保護の役割も果たす。
doorknob,0,/home/su-laptop-02-okitani/gmm_ws/data_processed/image/058_0081.npz,/home/su-laptop-02-okitani/gmm_ws/data_processed/audio/2-133889-A-30.npz,ドアノブとは、扉を開閉するために取り付けられる、手で握って操作する部品の総称である。 一般的には球形やレバー形をしており、内部の機構と連動して扉のラッチ（かんぬき）を動かすことで、扉の固定を解除したり、施錠したりする役割を担う。 その主な機能は、扉を閉じた状態から開ける、あるいは開いた状態から閉める際の操作を容易にすることにあり、住宅、オフィス、公共施設など、あらゆる建築物で不可欠な要素となっている。
doorknob,0,/home/su-laptop-02-okitani/gmm_ws/data_processed/image/058_0066.npz,/home/su-laptop-02-okitani/gmm_ws/data_processed/audio/1-52290-A-30.npz,機能的には、内部に組み込まれた錠前機構と連動しており、ノブを回す（またはレバーを下げる）ことでドア枠に引っかかっているラッチボルトが引っ込み、ドアが開く仕組みとなっている。 ドアノブは、住宅、オフィス、公共施設などあらゆる建物のドアに設置され、人々の出入りを制御する基本的な役割を担う。 多くの製品には、鍵穴やサムターンと一体化した施錠機能が備わっており、セキュリティの確保にも寄与する。
doorknob,0,/home/su-laptop-02-okitani/gmm_ws/data_processed/image/058_0015.npz,/home/su-laptop-02-okitani/gmm_ws/data_processed/audio/1-103995-A-30.npz,ドアノブの仕組みは、握り玉を回す、あるいはレバーハンドルを押し下げることで、内部のスピンドルと呼ばれる軸が回転し、これに接続されたラッチボルトが扉の側面から引っ込むことで、扉枠のストライクプレートからラッチが外れ、扉が開くというものである。 多くのドアノブには施錠機能が組み込まれており、鍵穴やサムターン（室内側のつまみ）と一体化している場合や、別途デッドボルトなどの施錠機構と連動している場合がある。 これにより、部屋のプライバシーを確保したり、外部からの侵入を防ぐ防犯対策として機能する。
doorknob,0,/home/su-laptop-02-okitani/gmm_ws/data_processed/image/058_0086.npz,/home/su-laptop-02-okitani/gmm_ws/data_processed/audio/5-218980-A-30.npz,ドアノブとは、ドアを開閉するために操作する取っ手の一種であり、ドアのラッチ機構と連動して機能する部品です。 その基本的な役割は、ドアを閉じた状態に保持しているラッチボルトを引っ込め、ドアが開く状態にすることにあります。 形状は、伝統的な球状のものが一般的ですが、近年では握りやすく、軽い力で操作できるレバー型（ドアレバーやレバーハンドルとも呼ばれる）も広く普及しており、特に高齢者や身体の不自由な方でも使いやすいバリアフリー設計の観点から推奨されることが多くなっています。
doorknob,0,/home/su-laptop-02-okitani/gmm_ws/data_processed/image/058_0069.npz,/home/su-laptop-02-okitani/gmm_ws/data_processed/audio/1-81001-B-30.npz,ドアノブとは、扉を開閉するために操作する取っ手であり、多くの場合、扉を閉じた状態に保つラッチ機構や、外部からの侵入を防ぐための施錠機構と一体化した部品の総称です。 その形状は、握って回す球状の「丸ノブ」が一般的で、コンパクトさが特徴ですが、近年では指で押し下げて操作する「レバーハンドル」が操作性の高さから広く普及し、また、押したり引いたりして開閉する「プッシュプルハンドル」は両手が塞がっている場合でも肘などで操作できる利便性から、多様なタイプが存在します。
doorknob,0,/home/su-laptop-02-okitani/gmm_ws/data_processed/image/058_0012.npz,/home/su-laptop-02-okitani/gmm_ws/data_processed/audio/1-101336-A-30.npz,建築デザインの一部としても重要な要素であり、空間の雰囲気を決定づける役割も担っています。
doorknob,0,/home/su-laptop-02-okitani/gmm_ws/data_processed/image/058_0023.npz,/home/su-laptop-02-okitani/gmm_ws/data_processed/audio/3-144510-A-30.npz,これらの素材やデザインは、設置される建築物の様式やインテリアデザインと調和するように選ばれることが一般的で、機能性だけでなく視覚的な要素も重視されます。 ドアノブの基本的な仕組みは、内部に組み込まれたラッチボルトと呼ばれる可動式の部品と連動しています。 ノブを回したりレバーを下げたりすることで、ラッチボルトが扉の枠から引っ込み、扉の固定が解除されて開閉が可能になります。
doorknob,0,/home/su-laptop-02-okitani/gmm_ws/data_processed/image/058_0016.npz,/home/su-laptop-02-okitani/gmm_ws/data_processed/audio/1-103995-A-30.npz,多くのドアノブには、鍵穴や、内側から手動で施錠・解錠するサムターンが一体化されており、これによりセキュリティ機能も兼ね備えている。 近年では、ユニバーサルデザインの観点から、握力の弱い人や高齢者、障害者でも容易に操作できるよう、少ない力で操作できるレバーハンドル型が普及しており、バリアフリー化の一環として採用されることが多い。 ドアノブのデザインは、建築様式やインテリアデザインに合わせて多様化しており、機能性だけでなく、空間の雰囲気を決定づける装飾品としての側面も持つ。
doorknob,0,/home/su-laptop-02-okitani/gmm_ws/data_processed/image/058_0058.npz,/home/su-laptop-02-okitani/gmm_ws/data_processed/audio/5-218980-A-30.npz,また、多くのドアノブには施錠機能が備わっており、鍵やサムターン（内側のつまみ）を操作することで、デッドボルトなどの施錠機構が作動し、扉を固定することができます。 ラッチボルトはバネの力で常に飛び出しており、扉を閉めるだけで自動的にかかるのに対し、デッドボルトは鍵やサムターンで操作しないと動かないため、より強固な施錠を可能にします。 用途は、住宅やオフィス、公共施設などあらゆる建物の扉のほか、家具の扉にも用いられ、そのデザインは建築様式やインテリアに合わせて多様なものが存在します。
doorknob,0,/home/su-laptop-02-okitani/gmm_ws/data_processed/image/058_0020.npz,/home/su-laptop-02-okitani/gmm_ws/data_processed/audio/5-251426-B-30.npz,握りやすさ、耐久性、安全性、そして衛生面も重要な選定基準となり、使用される環境や目的に応じて様々な種類が存在します。 ドアノブは、人が手で握って回したり押し下げたりすることで、扉を固定しているラッチボルトを引っ込め、扉の枠に設けられたストライクと呼ばれる受け金具からラッチボルトを外し、扉を開けることを可能にする基本的な役割を担います。 内部には、ノブの回転やレバーの動きをラッチボルトに伝えるためのカムやスピンドルといった機械部品が組み込まれています。
doorknob,0,/home/su-laptop-02-okitani/gmm_ws/data_processed/image/058_0006.npz,/home/su-laptop-02-okitani/gmm_ws/data_processed/audio/3-151089-A-30.npz,近年では、高齢者や身体の不自由な人でも容易に操作できるよう、軽い力で動かせるレバーハンドルがユニバーサルデザインの観点から広く普及している。 また、多くの人が触れる部位であるため、抗菌・抗ウイルス加工が施された製品や、非接触で開閉できる自動ドアシステムとの連携なども進化しており、衛生面や利便性の向上にも貢献している。
doorknob,0,/home/su-laptop-02-okitani/gmm_ws/data_processed/image/058_0027.npz,/home/su-laptop-02-okitani/gmm_ws/data_processed/audio/5-250026-B-30.npz,多くのドアノブには、防犯やプライバシー保護のために施錠機能が備わっており、鍵や内側のサムターン（つまみ）を操作することで、ラッチボルトを固定したり、デッドボルトと呼ばれる別の施錠機構を作動させたりします。 用途は住宅、オフィス、店舗、公共施設などあらゆる建築物の扉に及び、その歴史は古く、シンプルな取っ手から始まり、時代とともに素材や機構が進化してきました。
doorknob,0,/home/su-laptop-02-okitani/gmm_ws/data_processed/image/058_0048.npz,/home/su-laptop-02-okitani/gmm_ws/data_processed/audio/3-170574-A-30.npz,ドアノブとは、ドアを開閉するために操作する取っ手であり、多くの場合、ドアの施錠・解錠機構と一体化した部品を指します。 その形状は、球状のものが一般的ですが、レバー状の「ドアハンドル」や楕円形など多岐にわたり、素材も真鍮、ステンレス、アルミなどの金属、木、プラスチック、陶器、ガラスなど、用途やデザインに応じて様々です。 単なる開閉のための道具としてだけでなく、建築物の様式や内装デザインの一部として、その意匠性も重視されます。
doorknob,0,/home/su-laptop-02-okitani/gmm_ws/data_processed/image/058_0019.npz,/home/su-laptop-02-okitani/gmm_ws/data_processed/audio/1-81001-A-30.npz,建築デザインの一部としても重要な要素であり、空間の雰囲気を決定づける役割も担っています。
doorknob,0,/home/su-laptop-02-okitani/gmm_ws/data_processed/image/058_0045.npz,/home/su-laptop-02-okitani/gmm_ws/data_processed/audio/2-118624-A-30.npz,公共施設や多くの人が触れる場所では、抗菌加工が施された素材が用いられたり、非接触型の自動ドアが採用されたりするなど、衛生面への配慮も進化しています。
doorknob,0,/home/su-laptop-02-okitani/gmm_ws/data_processed/image/058_0047.npz,/home/su-laptop-02-okitani/gmm_ws/data_processed/audio/5-250026-B-30.npz,ドアノブとは、扉を開閉するために操作する取っ手の総称であり、多くの場合、扉を閉じた状態に保つラッチ機構や、施錠機能を持つ錠前と一体化した部品です。 その形状は、古典的な球形（丸ノブ）から、現代的なレバー型（ドアハンドル）まで多岐にわたり、使用される場所やデザイン、機能性に応じて様々な種類が存在します。 素材も、真鍮、ステンレス、アルミなどの金属、木材、プラスチック、陶器など多様であり、耐久性、美観、触感などが考慮されて選ばれます。
doorknob,0,/home/su-laptop-02-okitani/gmm_ws/data_processed/image/058_0081.npz,/home/su-laptop-02-okitani/gmm_ws/data_processed/audio/4-182034-A-30.npz,ドアノブの仕組みは、握り玉を回す、あるいはレバーハンドルを押し下げることで、内部のスピンドルと呼ばれる軸が回転し、これに接続されたラッチボルトが扉の側面から引っ込むことで、扉枠のストライクプレートからラッチが外れ、扉が開くというものである。 多くのドアノブには施錠機能が組み込まれており、鍵穴やサムターン（室内側のつまみ）と一体化している場合や、別途デッドボルトなどの施錠機構と連動している場合がある。 これにより、部屋のプライバシーを確保したり、外部からの侵入を防ぐ防犯対策として機能する。
