category,target,img,snd,text
washing-machine,2,,,これらの技術革新は、家事の効率化だけでなく、節水や節電といった環境負荷の低減にも貢献しており、衣類の清潔さを保つことで公衆衛生の維持にも重要な役割を果たしている。 また、洗剤や柔軟剤といった化学製品との組み合わせにより、洗浄効果の向上や衣類の風合いの保持、香り付けなど、多様なニーズに応えることが可能となっている。 家庭用だけでなく、コインランドリーや病院、ホテルなどの業務用としても広く利用され、現代社会における衛生管理と生活の質の向上に不可欠な存在となっている。
washing-machine,2,,/home/su-laptop-02-okitani/gmm_ws/data_processed/audio/1-32373-A-35.npz,0
washing-machine,2,,,洗濯機とは、衣類や布製品を水と洗剤を用いて洗浄し、脱水する機械である。 手洗いでは困難な大量の洗濯物を効率的に処理できる点が大きな特徴であり、現代の生活において衣類を清潔に保つために不可欠な家電製品の一つとして広く普及している。 家庭用として一般的に利用されるほか、コインランドリーやクリーニング店、病院、ホテルなどでは業務用として大型の洗濯機が用いられ、衛生管理や効率的な運営に貢献している。
washing-machine,2,,,主な種類としては、縦型とドラム型が存在し、それぞれ洗浄方式や水の消費量、衣類への負担、設置スペースなどに特徴がある。 縦型洗濯機は、たっぷりの水で衣類を揉み洗いする方式が多く、衣類全体を水に浸して洗うため、泥汚れなどに強いとされる。 一方、ドラム型洗濯機は、少ない水で衣類を持ち上げて落とす「叩き洗い」が主流であり、節水性に優れ、衣類の絡まりが少ない傾向にある。 多くの洗濯機には、洗浄後に高速回転による遠心力で衣類から水分を飛ばす脱水機能が備わっており、乾燥時間を大幅に短縮する。
washing-machine,2,,/home/su-laptop-02-okitani/gmm_ws/data_processed/audio/1-27166-A-35.npz,0
washing-machine,2,/home/su-laptop-02-okitani/gmm_ws/data_processed/image/239_0084.npz,,0
washing-machine,2,,,洗濯機とは、衣類やその他の布製品を水と洗剤を用いて自動的に洗浄する機械である。 手洗いに比べてはるかに効率的かつ衛生的に大量の洗濯物を処理できるため、現代の生活において家事の負担を大幅に軽減し、清潔な衣類を日常的に利用することを可能にしている。 家庭用として広く普及しているほか、コインランドリーや病院、ホテルなどの業務用としても多岐にわたって利用され、公衆衛生の維持にも貢献している。 その基本的な仕組みは、まず洗濯槽に水と洗剤を投入し、衣類を浸すことから始まる。
washing-machine,2,,,近年では、洗濯から乾燥までを一貫して行う洗濯乾燥機も普及しており、節水や省エネ、静音性、さらにはAIによる最適な洗濯プログラムの提案など、利用者のニーズに応じた技術革新が継続的に進められている。 これにより、衛生的な生活の維持に大きく貢献している。
washing-machine,2,,/home/su-laptop-02-okitani/gmm_ws/data_processed/audio/1-49098-A-35.npz,0
washing-machine,2,,/home/su-laptop-02-okitani/gmm_ws/data_processed/audio/3-151269-A-35.npz,0
washing-machine,2,/home/su-laptop-02-okitani/gmm_ws/data_processed/image/239_0024.npz,,0
washing-machine,2,,,撹拌方式には、洗濯槽の底にある羽根（パルセーター）を回転させて水流を起こし、衣類をこすり洗いする縦型や、洗濯槽自体を回転させて衣類を持ち上げて落とす「叩き洗い」を行うドラム型などがあり、それぞれ洗浄方法や水の消費量、衣類への負担などに違いがある。 洗浄工程の後には、洗剤成分を洗い流すためのすすぎが行われ、最後に高速回転による遠心力を用いて衣類から水分を飛ばす脱水工程が続く。 これらの工程の多くは自動または半自動で行われるため、利用者は洗濯物を投入し、洗剤をセットするだけで手軽に洗濯を完了できる。
washing-machine,2,/home/su-laptop-02-okitani/gmm_ws/data_processed/image/239_0007.npz,,0
washing-machine,2,,/home/su-laptop-02-okitani/gmm_ws/data_processed/audio/1-32373-A-35.npz,0
washing-machine,2,/home/su-laptop-02-okitani/gmm_ws/data_processed/image/239_0076.npz,,0
washing-machine,2,,,洗濯機とは、水と洗剤を用いて衣類や布製品を洗浄し、すすぎ、脱水までの一連の工程を自動または半自動で行う機械である。 手洗いに比べて大幅な労力の軽減と時間の短縮を実現し、一度に大量の洗濯物を処理できるため、現代の生活において不可欠な家電製品の一つとなっている。 家庭用として広く普及しているほか、コインランドリーやクリーニング店、病院、ホテルなどでは業務用として大型のものが利用され、その用途に応じた多様な機種が存在する。
washing-machine,2,,,洗濯機とは、衣類や布製品を水と洗剤を用いて洗浄する機械である。 これは、手洗いによる労力と時間を大幅に削減し、現代の生活において衛生的な衣類管理を可能にする家電製品として広く普及している。 その基本的な機能は、洗濯槽と呼ばれる容器に水、洗剤、そして洗濯物を入れ、モーターによって槽や内部の羽根を回転させることで、水流や撹拌、叩き洗いといった物理的な作用と洗剤の化学作用を組み合わせて汚れを繊維から分離・除去することにある。
washing-machine,2,,/home/su-laptop-02-okitani/gmm_ws/data_processed/audio/1-27165-A-35.npz,0
washing-machine,2,/home/su-laptop-02-okitani/gmm_ws/data_processed/image/239_0055.npz,,0
washing-machine,2,,/home/su-laptop-02-okitani/gmm_ws/data_processed/audio/1-23996-A-35.npz,0
washing-machine,2,/home/su-laptop-02-okitani/gmm_ws/data_processed/image/239_0051.npz,,0
windmill,3,/home/su-laptop-02-okitani/gmm_ws/data_processed/image/245_0078.npz,/home/su-laptop-02-okitani/gmm_ws/data_processed/audio/1-137296-A-16.npz,歴史的には、古くから穀物の製粉、水の汲み上げ（揚水）、木材の製材といった機械的な作業を行うための動力源として世界各地で利用されてきました。 特に、乾燥地帯での灌漑や、低地での排水など、人力や畜力では困難な大規模な作業を可能にしました。 現代においては、風車は主に風力発電の装置として広く普及しており、「風力タービン」とも呼ばれます。 風の力で羽根を回転させ、その回転運動を発電機に伝達することで電気エネルギーを生成する仕組みです。
windmill,3,/home/su-laptop-02-okitani/gmm_ws/data_processed/image/245_0074.npz,/home/su-laptop-02-okitani/gmm_ws/data_processed/audio/5-157204-A-16.npz,現代においては、風力発電の主要な装置として広く普及しており、風の力で羽根を回し、その回転運動を発電機に伝えて電気エネルギーを生成する。 風力発電用の風車は、風向に合わせて羽根の向きを調整するヨー制御や、強風時に羽根の角度を調整して回転速度を制御するピッチ制御などの高度な技術が組み込まれており、効率的かつ安全な電力供給を可能にしている。 風力エネルギーは、化石燃料に依存しない再生可能エネルギーの一つとして、地球温暖化対策やエネルギー自給率向上に貢献する重要な技術として世界中で導入が進められている。
windmill,3,/home/su-laptop-02-okitani/gmm_ws/data_processed/image/245_0011.npz,/home/su-laptop-02-okitani/gmm_ws/data_processed/audio/3-134699-C-16.npz,効率的な運用のため、風向の変化に合わせて本体の向きを変えるヨー制御や、風速に応じて羽根の角度を調整するピッチ制御といった高度な技術が組み込まれているものも多い。
windmill,3,/home/su-laptop-02-okitani/gmm_ws/data_processed/image/245_0053.npz,/home/su-laptop-02-okitani/gmm_ws/data_processed/audio/4-163609-A-16.npz,風車とは、風の力を受けて回転する羽根を持ち、その回転運動を動力源として利用する装置の総称である。 主に、風を受けるための羽根（ブレード）と、その回転を伝達・変換する機構、そして全体を支える構造物から構成される。 羽根の形状や配置は、効率よく風のエネルギーを捉えるために多様な工夫が凝らされており、歴史的には木材や布が用いられてきたが、現代では金属や複合材料が主流である。 古くから風車は、人類の生活や産業において重要な役割を担ってきた。
windmill,3,/home/su-laptop-02-okitani/gmm_ws/data_processed/image/245_0043.npz,/home/su-laptop-02-okitani/gmm_ws/data_processed/audio/1-51035-A-16.npz,風力発電の仕組みは、風によって回転する羽根の運動が、増速機を介して発電機を回し、電気を生み出すというものである。 自然の力を利用するため、運用時に温室効果ガスを排出しないという利点がある一方で、設置場所の選定、景観への影響、騒音、鳥類への影響といった課題も議論されることがある。
windmill,3,/home/su-laptop-02-okitani/gmm_ws/data_processed/image/245_0086.npz,/home/su-laptop-02-okitani/gmm_ws/data_processed/audio/1-51035-A-16.npz,風車とは、風の力を利用して羽根を回転させ、その回転運動を動力として利用する装置の総称である。 その基本的な構造は、風を受ける複数の羽根（ブレード）と、その回転を伝える軸、そして回転運動を目的の用途に変換する伝達機構から構成される。 古くから世界各地で利用されてきた歴史を持ち、灌漑のための揚水、穀物の製粉、木材の製材など、農業や生活に密着した様々な用途で活躍してきた。
windmill,3,/home/su-laptop-02-okitani/gmm_ws/data_processed/image/245_0008.npz,/home/su-laptop-02-okitani/gmm_ws/data_processed/audio/3-134699-C-16.npz,これは再生可能エネルギー源の一つとして、地球温暖化対策やエネルギー自給率向上への貢献が期待されており、陸上だけでなく洋上にも大規模な風力発電所が建設されている。 その一方で、設置場所の風況、騒音、景観への影響、鳥類への影響などが考慮されることもあり、持続可能な利用に向けた研究開発や環境アセスメントが進められている。
windmill,3,/home/su-laptop-02-okitani/gmm_ws/data_processed/image/245_0087.npz,/home/su-laptop-02-okitani/gmm_ws/data_processed/audio/1-137296-A-16.npz,環境に優しい再生可能エネルギー源として注目されており、陸上だけでなく洋上にも設置される大規模な風力発電所が世界各地で建設されている。 一方で、騒音や景観への影響、鳥類への衝突といった課題も指摘されており、技術開発や設置場所の選定において、これらの課題への配慮が継続的に求められている。
windmill,3,/home/su-laptop-02-okitani/gmm_ws/data_processed/image/245_0055.npz,/home/su-laptop-02-okitani/gmm_ws/data_processed/audio/1-47714-A-16.npz,その形状は多岐にわたり、風を受ける軸が地面に対して水平な水平軸型（プロペラ型）や、垂直な垂直軸型（サボニウス型、ダリウス型など）が存在し、それぞれの地域の風況や用途に合わせて発展してきた。 現代においては、風の運動エネルギーを電気エネルギーに変換する風力発電機としての利用が最も主要であり、再生可能エネルギー源の一つとして地球温暖化対策やエネルギー自給率向上に貢献する重要な技術として注目されている。 風力発電の仕組みは、風がブレードに作用することで揚力や抗力が発生し、これによりローターが回転する。
windmill,3,/home/su-laptop-02-okitani/gmm_ws/data_processed/image/245_0047.npz,/home/su-laptop-02-okitani/gmm_ws/data_processed/audio/5-217186-A-16.npz,風力発電は、化石燃料に依存しないクリーンな再生可能エネルギーの一つとして、地球温暖化問題への対策やエネルギーの持続可能性の観点から、世界中でその導入が強力に推進されている。 大規模な発電施設だけでなく、風向風速計、装飾品、子供のおもちゃなど、小規模なものや異なる目的で利用される風車も存在し、私たちの生活の様々な場面でその姿を見ることができる。
windmill,3,/home/su-laptop-02-okitani/gmm_ws/data_processed/image/245_0006.npz,/home/su-laptop-02-okitani/gmm_ws/data_processed/audio/1-51036-A-16.npz,羽根の形状、枚数、大きさ、設置方法によって多種多様な形式が存在し、それぞれの用途や地域の風況に合わせて最適化されてきた。 歴史的には、揚水（灌漑や排水）、穀物の製粉、木材の製材など、機械的な作業を行うための動力源として重要な役割を果たしてきた。 現代においては、風の運動エネルギーを電気エネルギーに変換する風力発電機として広く普及しており、再生可能エネルギー源の一つとして地球温暖化対策やエネルギー自給率向上への貢献が期待されている。
windmill,3,/home/su-laptop-02-okitani/gmm_ws/data_processed/image/245_0032.npz,/home/su-laptop-02-okitani/gmm_ws/data_processed/audio/5-217186-B-16.npz,風車とは、風の力を利用して羽根を回転させ、その回転運動を動力として利用する装置の総称である。 この装置は、風を受けるための羽根（ブレード）と、その回転を伝達・変換する機構、そして全体を支える塔や支柱などの構造物から主に構成される。 羽根の形状、枚数、材質、そして回転軸の向き（地面と平行な水平軸型や、地面と垂直な垂直軸型など）によって多種多様な形式が存在し、それぞれの用途や設置環境に応じて最適化されてきた歴史を持つ。
windmill,3,/home/su-laptop-02-okitani/gmm_ws/data_processed/image/245_0054.npz,/home/su-laptop-02-okitani/gmm_ws/data_processed/audio/2-109371-C-16.npz,陸上だけでなく、洋上にも設置される洋上風力発電も注目されており、より安定した風力を利用する試みが進められている。 化石燃料に依存しない再生可能エネルギー源であるため、地球温暖化対策やエネルギー安全保障の観点からその重要性は高まっており、効率向上やコスト削減に向けた技術開発も活発に進められている。 また、その独特な形状や、風を受けてゆっくりと回る姿は、地域のシンボルや景観の一部として親しまれることも少なくない。
windmill,3,/home/su-laptop-02-okitani/gmm_ws/data_processed/image/245_0012.npz,/home/su-laptop-02-okitani/gmm_ws/data_processed/audio/3-246513-A-16.npz,効率的な運用のため、風向の変化に合わせて本体の向きを変えるヨー制御や、風速に応じて羽根の角度を調整するピッチ制御といった高度な技術が組み込まれているものも多い。
windmill,3,/home/su-laptop-02-okitani/gmm_ws/data_processed/image/245_0035.npz,/home/su-laptop-02-okitani/gmm_ws/data_processed/audio/1-47714-A-16.npz,風車とは、風の力を利用して羽根（ブレード）を回転させ、その回転運動を動力として利用する装置の総称である。 主に、風の運動エネルギーを機械的エネルギーに変換する仕組みを持ち、その歴史は古く、人類が自然エネルギーを利用してきた代表的な例の一つとして知られている。 基本的な構造は、風を受けるための複数の羽根と、それらを支える軸、そして回転運動を伝達・変換する機構から成り立っており、羽根の配置によって水平軸型と垂直軸型に大別される。
windmill,3,/home/su-laptop-02-okitani/gmm_ws/data_processed/image/245_0069.npz,/home/su-laptop-02-okitani/gmm_ws/data_processed/audio/4-163606-A-16.npz,陸上だけでなく、洋上にも設置される洋上風力発電も注目されており、より安定した風力を利用する試みが進められている。 化石燃料に依存しない再生可能エネルギー源であるため、地球温暖化対策やエネルギー安全保障の観点からその重要性は高まっており、効率向上やコスト削減に向けた技術開発も活発に進められている。 また、その独特な形状や、風を受けてゆっくりと回る姿は、地域のシンボルや景観の一部として親しまれることも少なくない。
windmill,3,/home/su-laptop-02-okitani/gmm_ws/data_processed/image/245_0012.npz,/home/su-laptop-02-okitani/gmm_ws/data_processed/audio/3-134699-C-16.npz,風車とは、風の力を受けて羽根を回転させ、その回転運動を動力として利用する装置の総称である。 主に、風を受ける羽根（ブレード）と、その回転を伝達・変換する軸や歯車などの機構から構成され、古くから世界各地で様々な用途に用いられてきた。 その形式は多岐にわたり、風向きに対して軸が水平に配置される水平軸型と、垂直に配置される垂直軸型に大別される。 水平軸型は風上または風下に向かって羽根が回転するものが一般的で、垂直軸型は風向きに関わらず回転できる特徴を持つ。
windmill,3,/home/su-laptop-02-okitani/gmm_ws/data_processed/image/245_0029.npz,/home/su-laptop-02-okitani/gmm_ws/data_processed/audio/1-47714-A-16.npz,風車とは、風の力を利用して羽根を回転させ、その回転運動を動力として利用する装置の総称である。 その基本的な構造は、風を受ける複数の羽根（ブレード）と、その回転を伝える軸、そして回転運動を目的の用途に変換する伝達機構から構成される。 古くから世界各地で利用されてきた歴史を持ち、灌漑のための揚水、穀物の製粉、木材の製材など、農業や生活に密着した様々な用途で活躍してきた。
windmill,3,/home/su-laptop-02-okitani/gmm_ws/data_processed/image/245_0062.npz,/home/su-laptop-02-okitani/gmm_ws/data_processed/audio/4-163606-A-16.npz,大規模な風力発電所から、家庭用の小型発電機まで様々なスケールで利用されている。 また、動力源としての利用だけでなく、風向風速計、庭園の装飾品、子供のおもちゃなど、風の動きを目で楽しむための道具としても親しまれている。 地域によっては、その独特な形状が景観の一部として溶け込み、文化的な象徴となっている場所も少なくない。
windmill,3,/home/su-laptop-02-okitani/gmm_ws/data_processed/image/245_0066.npz,/home/su-laptop-02-okitani/gmm_ws/data_processed/audio/5-157204-A-16.npz,風車とは、風の力を受けて回転する羽根を持ち、その回転運動を動力源として利用する機械の総称である。 主に、風を受けるための羽根（ブレード）と、その回転を伝達・変換する機構、そして全体を支える塔や支柱から構成される。 羽根の形状や枚数、回転軸の向き（水平軸型、垂直軸型）によって様々な種類があり、古くから世界各地で利用されてきた。
windmill,3,/home/su-laptop-02-okitani/gmm_ws/data_processed/image/245_0013.npz,/home/su-laptop-02-okitani/gmm_ws/data_processed/audio/2-104952-B-16.npz,効率的な運用のため、風向の変化に合わせて本体の向きを変えるヨー制御や、風速に応じて羽根の角度を調整するピッチ制御といった高度な技術が組み込まれているものも多い。
windmill,3,/home/su-laptop-02-okitani/gmm_ws/data_processed/image/245_0084.npz,/home/su-laptop-02-okitani/gmm_ws/data_processed/audio/1-47714-A-16.npz,風車とは、風の力を利用して羽根（ブレード）を回転させ、その回転運動を動力として利用する装置の総称である。 主に、風の運動エネルギーを機械的エネルギーに変換する仕組みを持ち、その歴史は古く、人類が自然エネルギーを利用してきた代表的な例の一つとして知られている。 基本的な構造は、風を受けるための複数の羽根と、それらを支える軸、そして回転運動を伝達・変換する機構から成り立っており、羽根の配置によって水平軸型と垂直軸型に大別される。
windmill,3,/home/su-laptop-02-okitani/gmm_ws/data_processed/image/245_0063.npz,/home/su-laptop-02-okitani/gmm_ws/data_processed/audio/1-69760-A-16.npz,大規模な風力発電所が陸上や洋上に建設され、再生可能エネルギー源の一つとして、地球温暖化対策や持続可能な社会の実現に貢献している。 一方で、風力発電の導入にあたっては、騒音、景観への影響、鳥類への衝突リスクといった環境面への配慮も重要な課題として認識されており、技術開発や設置場所の選定においてこれらの課題解決が求められている。 小型のものは個人利用や教育用にも活用されるなど、その利用形態は多様である。
windmill,3,/home/su-laptop-02-okitani/gmm_ws/data_processed/image/245_0025.npz,/home/su-laptop-02-okitani/gmm_ws/data_processed/audio/5-157204-A-16.npz,現代においては、風力発電の主要な装置として、風の運動エネルギーを電気エネルギーに変換するために広く利用されている。 風が羽根に当たることで揚力や抗力が発生し、羽根が回転する仕組みであり、この回転運動がギアボックスなどの増速機を介して発電機を回すことで電気が生み出される。 大規模な風力発電機では、風向や風速の変化に対応するため、羽根の角度を調整するピッチ制御や、全体を風上に向けるヨー制御といった高度な制御機構を備えることで、効率的な発電を可能にしている。
windmill,3,/home/su-laptop-02-okitani/gmm_ws/data_processed/image/245_0001.npz,/home/su-laptop-02-okitani/gmm_ws/data_processed/audio/4-144083-B-16.npz,これは再生可能エネルギー源の一つとして、地球温暖化対策やエネルギー自給率向上への貢献が期待されており、陸上だけでなく洋上にも大規模な風力発電所が建設されている。 その一方で、設置場所の風況、騒音、景観への影響、鳥類への影響などが考慮されることもあり、持続可能な利用に向けた研究開発や環境アセスメントが進められている。
windmill,3,/home/su-laptop-02-okitani/gmm_ws/data_processed/image/245_0045.npz,/home/su-laptop-02-okitani/gmm_ws/data_processed/audio/2-109374-A-16.npz,風力発電の仕組みは、風によって回転する羽根の運動が、増速機を介して発電機を回し、電気を生み出すというものである。 自然の力を利用するため、運用時に温室効果ガスを排出しないという利点がある一方で、設置場所の選定、景観への影響、騒音、鳥類への影響といった課題も議論されることがある。
windmill,3,/home/su-laptop-02-okitani/gmm_ws/data_processed/image/245_0010.npz,/home/su-laptop-02-okitani/gmm_ws/data_processed/audio/1-47714-A-16.npz,風車とは、風の力を受けて回転する羽根（ブレード）を持ち、その回転運動を動力源として利用する装置の総称である。 その基本的な仕組みは、風の運動エネルギーを羽根の回転運動に変換し、その回転を軸や歯車などの伝達機構を通じて、特定の作業機械に伝えることにある。 主要な構成要素としては、風を受けるための複数の羽根、それらを支え回転させるローター、回転を伝える主軸、そして装置全体を支持する塔や構造物が挙げられる。
windmill,3,/home/su-laptop-02-okitani/gmm_ws/data_processed/image/245_0027.npz,/home/su-laptop-02-okitani/gmm_ws/data_processed/audio/4-163606-A-16.npz,風車とは、風の力を受けて回転する羽根を持ち、その回転運動を動力源として利用する機械の総称である。 主に、風を受けるための羽根（ブレード）と、その回転を伝達・変換する機構、そして全体を支える塔や支柱から構成される。 羽根の形状や枚数、回転軸の向き（水平軸型、垂直軸型）によって様々な種類があり、古くから世界各地で利用されてきた。
